name,description,major,size,impact,momentum,website,blurb
National Institute of Health,"The National Institute of Health (NIH) high school biology activity focuses on providing students with the opportunity to engage in hands-on laboratory work and research in the field of biology. This activity allows students to work alongside professional scientists and researchers to gain valuable practical experience in conducting experiments, analyzing data, and exploring various topics within the realm of biology. The main goal of this activity is to expose students to the real-world application of biology and foster an understanding of scientific research methodologies. Students will have the chance to delve into topics such as genetics, cellular biology, and environmental science through a series of interactive and immersive laboratory activities. This experience gives students a glimpse into the world of scientific research and helps them develop critical thinking and problem-solving skills essential for a future career in the biological sciences.",Science,2,3,1,https://www.nih.gov/,Students engage in hands-on scientific research at a renowned health institute.
UPenn Biomedical Research Program,"The UPenn Biomedical Research Program is a hands-on educational opportunity for students interested in the field of biology. Participants will engage in laboratory experiments, data analysis, and research projects under the guidance of experienced scientists and researchers. This program provides valuable insight into the biomedical field and allows students to gain practical experience in conducting experiments and analyzing results. It is a unique opportunity to explore the various career paths within the field of biology.",Science,1,2,1,https://hs.sas.upenn.edu/summer-programs/academies/biomedical,A program where students participate in biomedical research at UPenn.
USA Biology Olympiad,"The USA Biology Olympiad is a national competition that tests students' knowledge and understanding of biology. Participants are required to demonstrate their expertise in various areas of biology, including genetics, biochemistry, and cellular biology. The competition consists of two rounds, with the first being a written exam and the second involving laboratory practicals. Students who excel in the competition may have the opportunity to represent the United States in the International Biology Olympiad. This activity is ideal for students who have a strong interest in biology and are looking to challenge themselves in the subject.",Science,3,2,2,https://www.usabo-trc.org/,A competition testing students' knowledge of biology through challenging exams and practical assessments.
IChO,"The International Chemistry Olympiad (IChO) is a prestigious international competition that brings together top students from around the world to test their knowledge and skills in chemistry. Participants compete in a series of theoretical and practical exams that cover a wide range of topics in chemistry, including organic chemistry, inorganic chemistry, physical chemistry, and analytical chemistry. The main goal of the IChO is to promote interest and excellence in chemistry among young students and to provide a platform for them to showcase their talents on a global stage.",Science,3,2,1,https://www.ichosc.org/,A chemistry competition where students solve theoretical and practical problems.
U.S National Chemistry Olympiad,"The U.S National Chemistry Olympiad is a competitive exam that tests students' knowledge and understanding of chemistry. Participants are required to solve complex and challenging chemistry problems that assess their understanding of key concepts in the subject. The exam is designed to identify and reward students with exceptional skills in chemistry. It is a major national event that draws participants from across the country, providing an opportunity for students to showcase their expertise in the field of chemistry.",Science,3,2,2,https://www.acs.org/education/students/highschool/olympiad.html,A nationwide chemistry competition for students to showcase their knowledge and problem-solving skills.
Adopt-a-Physicist,"Adopt-a-Physicist is a program where students are paired with a professional physicist in the field. The physicist acts as a mentor, providing insight into their work and the physics industry. Students have the opportunity to ask questions, gain career advice, and learn about real-world applications of physics. This program allows students to explore the diverse career paths available in physics and gain valuable knowledge from experienced professionals in the field.",Science,1,2,1,https://www.adoptaphysicist.org/,Students are paired with a physicist to learn about their work and ask questions.
IYPT,"The International Young Physicists' Tournament (IYPT) is a competition where students work in teams to solve complex physics problems. The tournament focuses on researching, presenting, and defending solutions to 17 open-ended physics problems. Teams are judged on their ability to think critically, work collaboratively, and communicate effectively. The tournament encourages students to apply their knowledge of physics to real-world scenarios and develop problem-solving skills. This activity provides a platform for students to engage in scientific inquiry and develop a deeper understanding of physics concepts.",Science,3,2,1,https://www.iypt.org/,Students compete in a series of physics challenges focused on problem-solving and experimentation.
National Science Bowl,"The National Science Bowl (NSB) is an academic competition that tests students' knowledge in various areas of physics, including mechanics, electricity, magnetism, thermodynamics, and nuclear physics. Teams of students compete in a fast-paced quiz bowl format, answering questions on complex scientific concepts and theories. The competition emphasizes critical thinking, problem-solving, and teamwork, making it an excellent opportunity for students interested in pursuing a career in physics or related fields.",Science,3,2,1,https://science.osti.gov/wdts/nsb,A competitive science quiz where teams answer challenging science and math questions.
USA Physics Olympiad,"The USA Physics Olympiad is a national competition for students interested in physics. It is designed to test students' problem-solving skills and understanding of fundamental physics concepts. Participants are required to solve complex physics problems and demonstrate their understanding of various topics such as mechanics, electricity, magnetism, thermodynamics, and modern physics. The competition consists of two challenging exams, the preliminary and semifinal exams, which aim to identify and recognize top-performing students in the field of physics. The USA Physics Olympiad provides an opportunity for students to showcase their physics knowledge and compete at a national level.",Science,3,2,1,https://www.aapt.org/physicsteam/PT-landing.cfm,A physics competition where students solve complex problems to demonstrate their understanding of the subject.
Toshiba ExploraVision,"Toshiba ExploraVision is a STEM (Science, Technology, Engineering, and Math) activity where students work in teams to envision and research a technology that could exist in 20 years. They are required to choose a current technology and then brainstorm ideas for how it might evolve in the future. The students then research the current technology and predict what advancements might be made in the future, including potential benefits and challenges. The goal is for students to think critically and creatively about the potential of technology and its impact on the world.",Science,2,2,2,https://www.exploravision.org/,A project where students create innovative technology ideas.
Brower Youth Awards,"The Brower Youth Awards is an environmental science program that recognizes young people who have made significant contributions to environmental sustainability and activism. Participants in this program are required to develop and implement projects that address environmental issues in their communities. The major focus of the activity is to empower youth to take action on environmental issues and inspire others to do the same. Through this program, students have the opportunity to make a tangible impact on the environment and gain recognition for their efforts.",Science,2,2,1,https://www.broweryouthawards.org/,A science program that recognizes and supports youth environmental activists.
Envirothon,"Envirothon is a competitive, academic program that focuses on environmental science and natural resource management. It is a hands-on, team-based activity that challenges participants to apply their knowledge of ecology, forestry, wildlife, and soil and water resources to real-world environmental issues. The program involves field trips, outdoor activities, and studying wildlife and plant species. Teams compete in a series of tests and questions, and the winners may advance to state or national competitions. It is a great opportunity for students interested in environmental science to expand their knowledge and skills in a fun and engaging way.",Science,3,2,1,https://envirothon.org/,An environmental science competition where students compete in various disciplines.
The Summer Science Program,"The Summer Science Program offers a six-week astronomy course for students interested in studying the stars and celestial bodies. Participants will have the opportunity to work on real research projects in a team setting, using state-of-the-art telescopes and equipment. The program covers topics such as astrophysics, observational techniques, and data analysis. Students will also have the chance to visit top research facilities and engage with leading scientists in the field. This immersive experience provides a comprehensive introduction to the study of astronomy and can be a valuable addition to any student's academic pursuits.",Science,2,2,1,https://summerscience.org/the-ssp-experience/what-is-ssp/,A summer program for students to engage in hands-on science research and experiments.
Science Olympiad,"The Science Olympiad is a competitive science-based event that tests students' knowledge and skills in various scientific disciplines such as biology, chemistry, physics, and earth science. Participants compete in a series of events that challenge their critical thinking, problem-solving, and teamwork abilities. The activities range from written tests to hands-on experiments and engineering challenges. The Science Olympiad aims to foster an interest in science and technology while promoting collaboration and academic excellence.",Science,3,2,1,https://www.soinc.org/,A competitive event where students participate in various science-related challenges and activities.
ISEF,"The ISEF (International Science and Engineering Fair) is a global competition where students from around the world present their original research in the fields of science, technology, engineering, and mathematics (STEM). Participants showcase their projects to a panel of judges and compete for awards, scholarships, and recognition. The fair provides a platform for high school students to share their innovative ideas and discoveries with the scientific community, fostering a spirit of inquiry and collaboration. This event offers students the opportunity to gain valuable experience in presenting their work and networking with professionals in their field of study.",Science,3,3,1,https://www.societyforscience.org/isef/,A competition where students present original research projects in various scientific fields.
Regeneron Science Talent Search,"The Regeneron Science Talent Search is a prestigious science competition that allows students to showcase their research and scientific abilities. Participants conduct original research in the fields of science, engineering, mathematics, or medicine and submit their findings for review. Selected finalists are given the opportunity to present their work to leading scientists and compete for scholarships and recognition. This activity provides students with a platform to demonstrate their passion for scientific inquiry and innovation.",Science,3,2,1,https://www.societyforscience.org/regeneron-sts/,A research competition for students to showcase scientific projects and discoveries.
Simmons Summer Research Program,"The Simmons Summer Research Program is a program that allows students to engage in scientific research in a university setting. Students will have the opportunity to work closely with professors and graduate students in a specific scientific field, such as biology, chemistry, or environmental science. Through this program, students will gain hands-on experience in conducting experiments, analyzing data, and presenting their findings. This program provides a valuable opportunity for students to gain insight into the world of scientific research and potentially pursue a career in the sciences.",Science,2,2,1,https://www.stonybrook.edu/simons/,An opportunity for students to engage in scientific research over the summer.
Destination Imagination,"Destination Imagination is a creative writing activity that challenges participants to work together to solve open-ended challenges in the fields of STEM, fine arts, and service learning. Students will use their critical thinking, creativity, and collaborative skills to tackle complex problems and present their solutions in a live competition setting. The activity focuses on developing innovative thinking and effective communication, as well as fostering teamwork and leadership skills.",Writing,2,2,1,https://www.destinationimagination.org/,This activity involves teams creating and presenting unique solutions to creative challenges.
Gutenberg Award,"The Gutenberg Award is a journalism competition that recognizes outstanding achievement in the field of student journalism. Participants are required to submit various articles, photographs, and design layouts that demonstrate their skills in reporting, writing, and storytelling. A panel of judges evaluates the submissions and selects winners based on the quality and impact of their work. The award aims to promote excellence in journalism and inspire young writers to pursue careers in the field.",Writing,2,2,1,https://gceaonline.org/student-resources/student-contests/gutenberg-award/,Students write and submit original works for recognition.
John Locke Essay Competition,"The John Locke Global Essay Competition is an international competition that invites students to submit essays on current global issues from the perspective of political philosophy, particularly the ideas of John Locke. Participants are required to research and analyze a specific topic related to international relations, and present their arguments and opinions in a well-structured and coherent essay. This competition provides an opportunity for students to engage with complex global issues and develop their critical thinking and writing skills. The winners of the competition receive recognition and sometimes prizes for their work.",Writing,3,2,1,https://www.johnlockeinstitute.com/essay-competition,Students write essays on topics related to John Locke's philosophy for a chance to win prizes.
NACLO,"The North American Computational Linguistics Open Competition is a competition where students use computer programming and language analysis to solve linguistic problems. This activity is centered around the study of linguistics, which is the scientific study of language and its structure. Participants will work in teams to tackle real-world language processing challenges using computer algorithms and coding skills. The competition tests students' ability to analyze, manipulate, and understand human language using computational techniques. This activity provides an opportunity for students to apply their knowledge of linguistics in a practical and competitive setting.",Writing,2,2,1,https://naclo.org/,A competition where students analyze and solve language-based puzzles.
National English Honor Society,"The National English Honor Society is an academic organization that recognizes and promotes excellence in English language and literature. Members participate in activities that promote literacy, writing, and critical thinking skills. The society also engages in community service projects related to English and literacy. The major focus of the activity is to foster a love and appreciation for the English language and literature, and to encourage academic achievement in these areas.",Writing,2,2,1,https://www.nehs.us/,A writing activity that recognizes and promotes excellence in English language and literature.
Young Authors Writing Competition,"The Young Authors Writing Competition is an opportunity for students to showcase their writing skills and creativity by submitting original works of fiction, non-fiction, or poetry. Participants have the chance to have their work recognized and published, as well as to compete for prizes and awards. This activity allows students to hone their writing abilities, gain recognition for their talent, and potentially kickstart a career in writing.",Writing,2,2,1,https://blogs.colum.edu/youngauthors/,A writing competition for young writers to showcase their work and compete for recognition.