name,description,major,size,impact,momentum,website,blurb
National Economics Challenge,"The National Economics Challenge is a competition that tests participants' knowledge of economics. It is a nationwide event that brings together students to showcase their understanding of economic concepts and principles. Participants compete in teams to answer questions related to microeconomics, macroeconomics, international economics, and current events. The competition aims to promote economic literacy and critical thinking skills among high school students. It provides an opportunity for students to apply their classroom knowledge to real-world scenarios and gain valuable experience in economic analysis.",Economics,2,2,1,https://www.councilforeconed.org/programs/for-students/national-economic-challenge/,A competition where students showcase their understanding of economic principles through various challenges.
Quiz Bowl ,"Quiz Bowl is a competitive academic activity where teams of students compete to answer questions about history, literature, science, and other subjects. It is a fast-paced and challenging game that tests participants' knowledge and critical thinking skills. The activity is a great way to learn and review a wide range of topics, and it requires teamwork and quick thinking to succeed.",Education,2,2,1,https://www.naqt.com/about/quiz-bowl.html,A team-based competition where students answer questions on various academic subjects.
Schoolhouse.world,"Schoolhouse.world is an online platform that offers free educational resources and live tutoring sessions in various subjects, including math, science, and humanities. The major focus of the activity is to provide high-quality academic support to students through interactive virtual classrooms led by volunteer tutors. This allows students to receive personalized assistance and guidance in their studies, helping them to improve their understanding and performance in school. The platform also encourages collaboration and peer-to-peer learning among students.",Education,3,2,2,https://Schoolhouse.world,"An online platform connecting students with tutors for live, interactive lessons."
United States Academic Decathlon,"The United States Academic Decathlon is an academic competition that covers ten subjects, including art, economics, literature, mathematics, music, science, social science, and a super quiz on a specific theme. Students are tested on their knowledge through multiple-choice exams, essays, speeches, and interviews. The competition aims to promote academic excellence and foster a spirit of healthy competition among students. It provides an opportunity for participants to develop their critical thinking, public speaking, and time management skills.",Education,2,2,2,https://www.usad.org/,A team-based academic competition covering various subjects.
FIRST Robotics,"FIRST Robotics is a program that allows students to engage in hands-on engineering and problem-solving challenges. Participants work in teams to design, build, and program a robot to compete in a series of tasks and challenges. The activity focuses on applying principles of science, technology, engineering, and math (STEM) to real-world problems. Students have the opportunity to work with industry professionals and gain experience in project management, teamwork, and critical thinking. It provides a platform for students to develop practical skills in a collaborative and competitive environment.",Engineering,3,2,1,https://info.firstinspires.org/,"Students design, build, and program a robot to compete in a yearly challenge."
MITES Summer,"MITES Summer is a program offered by the Massachusetts Institute of Technology (MIT) that focuses on engineering. This program provides students with the opportunity to engage in hands-on engineering projects, take part in workshops and seminars, and receive mentorship from professors and industry professionals. Participants will also have the chance to explore various engineering disciplines and gain valuable insight into the field. Overall, MITES Summer offers a comprehensive and immersive experience for students interested in pursuing a career in engineering.",Engineering,2,2,1,https://mites.mit.edu/,A summer program that offers engineering courses and hands-on projects at a prestigious university.
RSI,"RSI, or Research Science Institute, is a program that offers high school students the opportunity to engage in cutting-edge scientific research in the field of engineering. Participants work with leading researchers and experts in the field to gain hands-on experience and insight into the latest developments in engineering. The program aims to provide students with a deeper understanding of engineering principles and methodologies through intensive research projects and mentorship. Students have the chance to explore various subfields within engineering, such as electrical, mechanical, civil, and biomedical engineering, and to develop their problem-solving and critical thinking skills. RSI is a highly competitive and prestigious program that provides a unique opportunity for high school students to immerse themselves in the world of engineering research.",Engineering,2,3,1,https://www.cee.org/programs/research-science-institute,A summer program for students interested in research and engineering.
VCU Contest,"The VCU Contest is an engineering competition where students have the opportunity to showcase their problem-solving skills and knowledge of engineering principles. Participants are presented with real-world engineering challenges and are tasked with designing and building a solution within a specified time frame. This competition allows students to apply their classroom learning to practical, hands-on projects and gain valuable experience in the field of engineering. It provides a platform for students to demonstrate their creativity, innovation, and technical abilities.",Engineering,2,2,1,https://egr.vcu.edu/departments/computer/about/high-school-programming-contest/,A competition where students showcase their engineering projects and compete for awards.
American Rocketry Challenge,"The American Rocketry Challenge is a competition that challenges students to design, build, and launch a model rocket to specific height and time parameters. This activity combines elements of physics, engineering, and mathematics as students work together to problem-solve and innovate in order to meet the competition's criteria. The challenge encourages students to apply their knowledge of aerodynamics and propulsion to create a successful rocket design. It provides a hands-on opportunity for students to engage in practical engineering and develop their teamwork and communication skills.",Engineering,2,2,1,https://rocketcontest.org/,Students design and launch rockets to meet specific altitude and flight duration targets.
Anson L. Clark Scholars Program,"The Anson L. Clark Scholars Program is a prestigious scholarship activity that provides financial assistance to students pursuing a degree in engineering. This program is designed to support high achieving students who demonstrate a strong interest in the field of engineering and show potential for future success in the industry. Through this program, students have the opportunity to receive financial aid to help cover the costs of their education, as well as access to networking and mentorship opportunities within the engineering community. The program aims to support and encourage talented individuals to pursue careers in engineering, ultimately contributing to the advancement of the field.",Engineering,1,2,1,https://www.depts.ttu.edu/honors/academicsandenrichment/affiliatedandhighschool/clarks/,A program that offers high school students the opportunity to explore various engineering fields through hands-on projects and mentorship.
Beaver Works,"Beaver Works is an engineering program that focuses on teaching students about various engineering principles and practices. The main goal of this activity is to provide hands-on experience in a wide range of engineering fields, such as mechanical, electrical, and civil engineering. Students will have the opportunity to work on real-world engineering projects, collaborate with peers, and learn from industry professionals. This program aims to develop problem-solving skills, critical thinking, and creativity in the field of engineering.",Engineering,2,2,1,https://beaverworks.ll.mit.edu/CMS/bw/bwsi,"Students design and build various engineering projects, gaining hands-on experience in problem-solving and innovation."
BHSEP,"The Berkeley High School Entrepreneurship Program is a hands-on engineering program that allows students to work on real-world engineering projects. Participants will have the opportunity to apply principles from various engineering fields, such as mechanical, electrical, and civil engineering, to solve practical problems. The program aims to give students a taste of what it's like to work as an engineer and to develop their problem-solving and critical thinking skills. Students will work in teams to design, build, and test their solutions, gaining valuable experience and insight into the field of engineering.",Engineering,1,2,1,https://www.decaversity.com/,A high school engineering program where students work on real-world projects.
Botball Educational Robotics Program,"The Botball Educational Robotics Program is an engineering activity that focuses on building and programming robots to complete various tasks. Participants work in teams to design, build, and code their robots to compete in a series of challenges. The program is designed to teach students about engineering, computer programming, and problem-solving skills. It provides hands-on experience in a competitive and collaborative environment, allowing students to apply what they have learned in the classroom to real-world challenges. This program is ideal for students interested in pursuing a career in engineering or technology.",Engineering,1,2,1,https://www.kipr.org/botball,Students use robots to complete specific tasks and compete in a robotics program.
Conrad Challenge,"The Conrad Challenge is a competition where students have the opportunity to develop innovative solutions to real-world problems in the field of engineering. Participants work in teams to create a product or service that addresses a specific challenge, such as improving access to clean water or developing sustainable energy solutions. Throughout the process, students are mentored by industry professionals and receive feedback on their ideas. The goal of the challenge is to encourage creativity, critical thinking, and collaboration, while also providing practical experience in the field of engineering.",Engineering,3,2,1,https://www.conradchallenge.org/,A competition where students create innovative solutions to real-world problems.
FPSPI,"The Future Problem Solving Program International (FPSPI) is an academic competition that challenges students to think critically and creatively about global issues. Participants work in teams to analyze complex problems and develop innovative solutions using a structured problem-solving process. The major focus of the activity is to develop critical thinking, creativity, and collaboration skills. Students are given a future scenario and are tasked with identifying and proposing solutions to potential challenges and opportunities. The program encourages students to think analytically, consider multiple perspectives, and communicate their ideas effectively.",Engineering,2,2,1,https://www.fpspi.org/,Students solve real-world problems using engineering principles and present their solutions to judges.
Future Engineers Competition,"Future Engineers Competition is an annual engineering competition where participants are tasked with solving a real-world engineering challenge. Students work in teams to design, build, and test their solutions, which are then judged based on creativity, functionality, and effectiveness. The competition is a great opportunity to apply engineering principles in a hands-on setting and to gain practical experience in problem-solving and innovation. It also provides a platform for students to showcase their skills and knowledge in the field of engineering.",Engineering,2,2,1,https://www.futureengineers.org/,A competition where students design and build innovative engineering projects.
GYEC,"The Global Youth Entrepreneurship Challenge (GYEC) is a competition where students develop and pitch business ideas to a panel of judges. The goal is to foster innovation, creativity, and problem-solving skills in the field of entrepreneurship. Participants will have the opportunity to network with industry professionals, receive feedback on their ideas, and potentially win prizes for their business concepts. This activity provides a platform for students to showcase their entrepreneurial talents and gain real-world experience in the business world.",Engineering,2,2,1,https://entreplanet.org/GYEC/,A program that allows students to work on engineering projects with industry professionals.
Bridge Building Contest,"The Highschool Bridge Building Contest is an engineering competition where participants design and build a small-scale bridge using specific materials. The goal is to construct a bridge that can hold the most weight without breaking. The activity allows students to apply principles of physics and structural engineering to create a strong and efficient bridge design. Participants have the opportunity to test their problem-solving and critical thinking skills while gaining hands-on experience in the field of engineering. The contest encourages students to collaborate, innovate, and explore the practical applications of their academic knowledge.",Engineering,2,1,1,https://www.bnl.gov/bridgebuilding/,Students design and construct bridges using specified materials to test strength and weight-bearing capacity.
MATE ROV Competition,"The MATE ROV Competition is an engineering competition where teams design, build, and pilot an underwater remotely operated vehicle (ROV). The competition aims to simulate real-world engineering challenges in ocean exploration and research. Participants are tasked with completing specific tasks such as collecting samples, installing equipment, and navigating obstacles in a simulated underwater environment. The competition encourages teamwork, problem-solving, and hands-on engineering skills. It provides a practical application of engineering principles and introduces students to potential career paths in marine technology and engineering.",Engineering,2,2,1,https://materovcompetition.org/,Students design and build underwater robots to compete in various tasks.
MIT THINK Research Program,"The MIT THINK Research Program is an engineering-focused activity that allows students to engage in hands-on research and project-based learning. Participants have the opportunity to work on real-world engineering challenges and develop innovative solutions. The program covers a wide range of engineering disciplines, including mechanical, electrical, and computer engineering. Students will have the chance to collaborate with peers and mentors, gaining valuable experience and insights into the field of engineering. This program offers a unique opportunity to apply classroom knowledge to practical, real-world situations, and to develop critical thinking and problem-solving skills.",Engineering,2,2,1,https://think.mit.edu/,Students engage in scientific research projects mentored by MIT students.
Human Exploration Rover Challenge,"The Human Exploration Rover Challenge is an engineering activity focused on designing and building a human-powered rover for off-road exploration. Participants work in teams to create a vehicle capable of navigating a simulated planetary surface, complete with obstacles and challenging terrain. The goal is to promote problem-solving, innovation, and teamwork while applying principles of engineering and design. The challenge provides a hands-on opportunity to apply theoretical knowledge to a practical, real-world problem.",Engineering,3,2,1,https://www.nasa.gov/learning-resources/nasa-human-exploration-rover-challenge/,"Students design, build, and test a human-powered rover for navigating various terrains."
Odyssey of the Mind,"Odyssey of the Mind is an engineering-based problem-solving competition that involves teams of students working together to solve complex challenges. Participants are given a specific problem to solve within a set time frame, and they must design, build, and present a solution to a panel of judges. The challenges often require creative thinking, engineering skills, and teamwork to successfully complete. This activity provides students with the opportunity to develop their problem-solving abilities and engineering skills in a fun and competitive environment.",Engineering,2,2,1,https://www.odysseyofthemind.com/,A creative problem-solving competition for students to showcase their engineering skills.
Project Paradigm,"Project Paradigm is an engineering activity that involves designing and building a prototype that addresses a real-world problem. Participants work in teams to identify an issue and create a solution using engineering principles. The activity encourages students to think critically, collaborate with peers, and apply their knowledge of math and science to create a practical and innovative design. The goal is to develop a functional prototype that can effectively solve the identified problem. This activity provides students with hands-on experience in engineering and problem-solving skills.",Engineering,2,2,1,https://www.projectparadigm.org/,Students work in teams to design and build a prototype to address a real-world problem.
The Plant the Moon Challenge,"The Plant the Moon Challenge is an aerospace engineering activity that involves designing and building a prototype lunar greenhouse. Participants are tasked with creating a sustainable and efficient system for growing plants on the moon using limited resources and space. The challenge requires students to apply their knowledge of engineering, physics, and biology to solve real-world problems related to space exploration. Through this activity, students gain practical experience in the field of aerospace engineering and develop critical thinking and problem-solving skills.",Engineering,2,2,1,https://plantthemoon.com/,Students design and build a device to plant a seed in a simulated lunar surface.
RoboCup Robotics Competition,"The RoboCup Robotics Competition is an engineering activity where teams design, build, and program autonomous robots to compete in various challenges. The major focus of the activity is to promote advancements in robotics and artificial intelligence. Teams work together to develop innovative strategies and technologies to navigate through obstacles, complete tasks, and ultimately win the competition. This hands-on experience allows students to apply their knowledge in engineering, computer science, and problem-solving to create functional and efficient robotic systems.",Engineering,2,2,1,https://www.robocup.org/,Students design and build robots to compete in various challenges.
RISE,"RISE is an engineering program that focuses on the principles of research, innovation, and design. Students in this program have the opportunity to work on real-world engineering projects, apply problem-solving skills, and gain hands-on experience in various engineering fields such as mechanical, electrical, and civil engineering. The program also emphasizes collaboration, communication, and critical thinking, which are essential skills for a successful career in engineering. Through RISE, students can explore their interests in engineering and gain valuable insight into the field before pursuing further education or a career in engineering.",Engineering,2,2,2,https://www.bu.edu/mysummer/academics/research-internship-in-science-engineering/,A high school engineering program that focuses on hands-on projects and problem-solving.
Rube Goldberg Machine Contest,"The Rube Goldberg Machine Contest is an engineering activity where participants are challenged to design and build a complex machine that performs a simple task in a convoluted way. The goal is to use everyday materials to create a chain reaction that ultimately completes the assigned task. This activity allows students to apply their knowledge of physics and engineering principles in a practical and creative manner. It also fosters teamwork, problem-solving, and innovation. This competition provides an opportunity for students to showcase their skills in designing and constructing intricate machines while also having fun.",Engineering,2,2,1,https://www.rubegoldberg.org/rube-goldberg-contests/,Students design and build a complex machine to complete a simple task using a series of chain reactions.
Samsung Solve for Tomorrow Challenge,"The Samsung Solve for Tomorrow Challenge is an engineering competition that encourages students to identify a community issue and develop a solution using STEM (science, technology, engineering, and math) principles. Students work in teams to research a local problem, design a project to address it, and then build a prototype or model. The goal is to create an innovative and practical solution that can have a positive impact on the community. The challenge provides an opportunity for students to apply their engineering skills to real-world problems and make a difference in their local area.",Engineering,2,2,1,https://www.samsung.com/us/solvefortomorrow/,Students use engineering to solve real-world problems in their communities.
TEAMS,"TEAMS, or Tests of Engineering Aptitude, Mathematics, and Science, is an engineering-based competition that challenges participants to solve real-world engineering problems within a designated time frame. The activity involves a series of written and hands-on challenges that test students' knowledge and skills in the fields of engineering, mathematics, and science. Teams are required to work together to develop innovative solutions to complex problems, fostering collaboration, critical thinking, and problem-solving skills. This activity provides a practical application of engineering principles and allows students to showcase their abilities in a competitive environment.",Engineering,2,2,1,https://www.microsoft.com/en-us/microsoft-teams/group-chat-software,A competitive engineering challenge where students work in teams to solve real-world problems.
Technology Student Association,"The Technology Student Association is an engineering-focused extracurricular activity that allows students to explore various aspects of technology and engineering. Members have the opportunity to participate in competitions, workshops, and projects related to fields such as robotics, computer-aided design, and digital media production. The major of this activity is to provide students with hands-on experience and knowledge in the field of engineering and technology, as well as the opportunity to develop leadership and teamwork skills.",Engineering,2,2,2,https://tsaweb.org/,A club focused on applying technology and engineering concepts to solve real-world problems.
VEX Robotics,"VEX Robotics is an engineering activity focused on designing, building, and programming robots to compete in various challenges. Participants work in teams to create robots using VEX Robotics kits, which include various mechanical and electronic components. The main goal is to develop robots that can complete specific tasks, such as moving objects, navigating obstacles, or competing in head-to-head matches. This activity provides hands-on experience in engineering, problem-solving, and teamwork.",Engineering,3,2,1,https://www.vexrobotics.com/,This activity involves building and programming robots to complete specific challenges.
Poetry Out Loud,"Poetry Out Loud is a national competition where participants memorize and recite poems in front of an audience. The main goal is to encourage students to engage with poetry and improve their public speaking skills. Participants choose poems from an anthology provided by the program and are judged on their interpretation and performance. The competition is divided into local, state, and national levels, with winners receiving prizes and recognition. This activity provides an opportunity to explore and appreciate poetry while developing confidence and communication abilities.",English,3,1,1,https://www.poetryoutloud.org/,Students recite poems from memory in a competition.
Blue Ocean Competition,"The Blue Ocean Entrepreneur Pitch Competition is a business-focused event where participants present their innovative ideas for new products or services to a panel of judges. The goal is to come up with a business concept that stands out from existing offerings in the market, creating a ""blue ocean"" of uncontested market space. Participants must research their target audience, develop a business plan, and create a compelling pitch to convince the judges of the potential success of their idea. The competition provides an opportunity for students to apply their entrepreneurial skills and creativity to real-world business challenges.",Entrepreneurship,2,2,2,https://www.schoolenterprisechallenge.org/,Students create and pitch innovative business ideas to a panel of judges.
