name,description,major,size,impact,momentum,website,blurb
Congressional Art Competition,"The Congressional Art Competition is a nationwide contest where students submit their artwork for a chance to have it displayed in the United States Capitol building for one year. The competition is open to all high school students and provides an opportunity for young artists to showcase their talents on a national stage. The winner of the competition also receives a scholarship and the chance to attend a reception in Washington, D.C. The purpose of the competition is to recognize and encourage artistic talent across the country. It is a prestigious event that allows students to gain recognition for their creative abilities and potentially launch a career in the arts.",Art,2,1,1,https://www.house.gov/educators-and-students/congressional-art-competition,A competition where students create and submit original artwork to be displayed in a government building.
Doodle 4 Google,The Doodle 4 Google Competition is an art activity where participants create a unique design for the Google logo based on a specific theme. The major of the activity is to showcase creativity and artistic talent by incorporating the theme into a visually appealing and original design. The winning design will be featured on the Google homepage for a day and the winner will receive a scholarship and technology grant for their school.,Art,3,2,1,https://doodles.google.com/d4g/,Students create original artwork for a design contest.
National Geographic Photo Contest,"The National Geographic Student Photo Contest is a photography competition that allows students to submit their original photographs for a chance to be featured in National Geographic magazine. Participants can capture and submit images of landscapes, wildlife, people, and cultures from around the world. This activity provides students with the opportunity to showcase their photography skills and creativity on a national platform. It also encourages students to explore different cultures and environments through the lens of a camera. The contest aims to inspire young photographers to document and appreciate the beauty and diversity of the world around them.",Art,3,2,1,https://www.nationalgeographic.com/contests,Students submit photos to a contest for a chance to be featured in a well-known magazine.
National Art Honor Society,"The National Art Honor Society is an organization that recognizes and encourages students with a strong interest and talent in the visual arts. Members have the opportunity to participate in various art-related activities, such as community service projects, art exhibitions, and workshops. The main goal of the National Art Honor Society is to promote artistic excellence and foster creativity among its members.",Art,2,2,2,https://www.arteducators.org/national-art-honor-societies,"A club for students with a passion for art, where they can participate in artistic projects and community service."
Scholastic Art and Writing Awards,"The Scholastic Art and Writing Awards is a national program that recognizes and encourages the artistic talents of high school students. It provides a platform for students to submit their creative works in various categories such as visual arts, photography, poetry, and short stories. The program aims to celebrate and showcase the artistic achievements of young individuals, providing them with the opportunity to gain recognition and potentially earn scholarships. It also offers students the chance to have their work reviewed by professionals in the arts and literary fields, creating a valuable learning experience.",Art,2,2,1,https://www.artandwriting.org/,A national art and writing competition for students.
Sony World Photography Competition,"The Sony World Photography Awards Youth Competition is a global photography contest that invites young people from all over the world to submit their best photographs. The competition aims to showcase the creativity and talent of young photographers and provide them with a platform to gain recognition for their work. Participants can submit their photographs in various categories, such as landscape, portrait, street photography, and more. The competition provides an opportunity for young photographers to compete at an international level and have their work evaluated by professional photographers and industry experts. It is a chance for young photographers to gain exposure and potentially kickstart their careers in photography.",Art,2,2,1,https://www.worldphoto.org/sony-world-photography-awards/youth,Students submit original photographs for a chance to win a competition.
Vans Custom Culture Art Competition,"The Vans Custom Culture Art Competition is a nationwide contest that encourages participants to design and create custom artwork on a pair of Vans shoes. The competition aims to promote creativity and self-expression through art, and to provide a platform for young artists to showcase their talent. The major of the activity is to inspire students to think outside the box and use their artistic skills to transform a blank canvas into a unique and original piece of wearable art. Participants have the opportunity to compete for a chance to win prize money for their school's art program, as well as have their designs featured on Vans shoes.",Art,3,2,1,https://customculture.vans.com/,Students create designs for a specific type of footwear and compete for a chance to have their designs produced and sold.
FBLA,"FBLA, or Future Business Leaders of America, is an organization that focuses on developing leadership and business skills in its members. Through FBLA, students have the opportunity to participate in a wide range of activities, including business competitions, community service projects, and networking events. The major of the activity is business, and participants can expect to gain valuable skills in areas such as public speaking, project management, and entrepreneurship. FBLA provides a platform for students to explore their interests in business and gain practical experience that can benefit them in their future careers.",Business,3,2,1,https://www.fbla.org/,A business organization for students to develop leadership and career skills.
B of A Student Leaders Program,"The Bank of America Student Leaders Program is a program designed to provide young adults with the opportunity to gain real-world experience and develop leadership skills in the field of business. Participants will have the chance to work with professionals at Bank of America and partner organizations, engage in leadership training, and take part in a paid summer internship. This program offers valuable insight into the world of business and provides students with the tools and knowledge to succeed in a professional setting.",Business,2,2,1,https://about.bankofamerica.com/en/making-an-impact/student-leaders,A program that provides students with leadership and professional development opportunities.
The Berkeley Academic Year Program,"The Berkeley Academic Year Program is a business-focused academic program designed to provide students with a comprehensive understanding of various business principles and practices. Through a combination of lectures, workshops, and hands-on projects, participants will gain insight into topics such as marketing, finance, management, and entrepreneurship. This program offers a unique opportunity to develop essential skills for future success in the business world.",Business,1,2,1,https://haas.berkeley.edu/business-academy/academic-year-program/,A program focused on business education and real-world experience.
Business Professionals of America,"Business Professionals of America (BPA) is an organization that provides high school students with the opportunity to develop leadership, academic, and technological skills. The major focus of BPA is on preparing students for careers in business and related fields. Members participate in various competitions, workshops, and conferences that allow them to gain real-world experience and practical knowledge in areas such as finance, accounting, marketing, and management. Through these activities, students can network with industry professionals, enhance their resume, and build valuable skills for their future careers.",Business,3,2,1,https://bpa.org/,A club that provides students with opportunities to develop leadership and business skills through competitions and networking.
DECA ,"DECA is a business organization that allows students to develop key business and marketing skills through hands-on activities, competitions, and real-world experience. Students in DECA learn about marketing, entrepreneurship, finance, hospitality, and management, and have the opportunity to network with professionals in the business world. The organization provides students with the opportunity to apply what they learn in the classroom to real-world situations, preparing them for future careers in the business and marketing fields.",Business,3,2,1,https://www.deca.org/,A business-focused club that provides students with opportunities to develop leadership and entrepreneurship skills through competitions and networking.
GATSVI Clubs and Venture Challenge,"GATSVI Clubs and Venture Challenge is a business activity that focuses on entrepreneurship and innovation. Students work in teams to develop and pitch business ideas, solve real-world business challenges, and compete in a business venture challenge. This activity provides an opportunity for students to develop their business and leadership skills, network with professionals, and gain practical experience in the business world. It is a great way for students interested in business to apply classroom knowledge to real-life situations and gain valuable experience in the field.",Business,2,1,1,https://www.gatsvi.org/,Students participate in entrepreneurial clubs and compete in a business venture challenge.
Wharton Future of Business,"The Wharton Future of the Business World Program is a program designed to provide students with an in-depth understanding of the business world. Participants will have the opportunity to explore a variety of business topics including finance, marketing, entrepreneurship, and management. Through lectures, workshops, and hands-on projects, students will gain practical skills and knowledge that are essential for success in the business field. This program offers a valuable insight into the different aspects of business and can help students make informed decisions about their future career paths.",Business,2,2,1,https://globalyouth.wharton.upenn.edu/programs-courses/future-of-the-business-world/,A program focused on exploring the future of business through workshops and case studies.
Wharton Leadership in Business,"The Wharton Leadership in the Business World Program is a summer program for students interested in the field of business. This program offers a comprehensive curriculum focused on business leadership, entrepreneurship, and management. Participants have the opportunity to learn from top business faculty, engage in hands-on team projects, and network with industry professionals. This program provides a valuable introduction to the business world and helps students develop essential skills for a future career in business.",Business,2,2,1,https://globalyouth.wharton.upenn.edu/programs-courses/leadership-in-the-business-world/,A program focused on developing leadership skills and business acumen for students.
Yale DHSRI Investment Competition,"The Yale DHSRI High School Investment Competition is an opportunity for students to learn about finance and investing. Participants will form teams and manage a virtual stock portfolio over the course of several weeks. They will research and analyze various stocks, make investment decisions, and track the performance of their portfolio. The competition provides a hands-on experience in the world of finance and allows students to gain practical knowledge about the stock market and investment strategies. This activity can help students develop critical thinking skills and gain a better understanding of how financial markets operate.",Business,2,2,1,https://dhsri.sites.yale.edu/,A stock investment competition where students manage a virtual portfolio.
4H Club,"The 4H Club is a community service activity focused on agricultural and environmental education. Participants engage in hands-on activities such as gardening, animal care, and environmental conservation projects. The club provides opportunities to develop leadership skills, teamwork, and a sense of responsibility through community service initiatives. Members have the chance to learn about sustainable practices and contribute to the betterment of their local community.",Community Service,3,1,1,https://4-h.org/,A club focused on community service and agricultural education.
Habitat for Humanity,"Habitat for Humanity is an architecture activity that involves working with a non-profit organization to build and renovate homes for families in need. Participants work alongside skilled professionals and volunteers to construct or improve housing structures, gaining hands-on experience in architectural design and construction. This activity provides an opportunity to apply classroom knowledge to real-world projects, while also making a positive impact on the community by providing safe and affordable housing options for those in need.",Community Service,2,3,1,https://www.habitat.org/,Students volunteer to help build homes for families in need.
Key Club,"Key Club is a student-led organization that focuses on community service and volunteerism. Members work together to plan and participate in various service projects, such as volunteering at local shelters, organizing fundraisers for charity, and participating in environmental clean-up efforts. The main goal of Key Club is to make a positive impact on the community by giving back and helping those in need. It is a great way to gain leadership experience and make a difference in the world.",Community Service,3,2,1,https://www.keyclub.org/,A student-led organization that focuses on community service and volunteer work.
Interact Club,"The Interact Club is a community service organization that focuses on providing volunteer opportunities for its members. The main goal of the club is to make a positive impact in the local community through various service projects and initiatives. Members participate in activities such as organizing fundraisers, volunteering at local shelters, and participating in environmental clean-up efforts. The club offers a way for students to give back to their community and gain valuable experience in leadership and teamwork.",Community Service,3,2,1,https://www.rotary.org/en/get-involved/interact-clubs,A club that organizes community service projects and fundraisers.
Association for Computing Machinery,"The Association for Computing Machinery (ACM) is a club for students interested in computer science. It provides opportunities for members to participate in coding competitions, attend workshops, and listen to guest speakers from the tech industry. The club also organizes hackathons and coding events where students can collaborate on projects and develop their programming skills. Additionally, the ACM offers networking opportunities and resources for students interested in pursuing a career in technology.",Computer Science,3,2,1,https://www.acm.org/,A club for students interested in computer science and technology.
ACSL,"ACSL (American Computer Science League) is a competitive computer science activity that involves solving programming problems and answering theoretical questions related to computer science. It is a major activity for students interested in coding and problem-solving. Participants compete in five contests throughout the school year, testing their skills in areas such as algorithms, data structures, and computer system architecture. The goal of ACSL is to promote interest and proficiency in computer science among high school students, and to provide a platform for them to showcase their knowledge and abilities in the field.",Computer Science,2,2,1,https://www.acsl.org/,A competition where students solve programming problems in teams.
Carnegie Mellon CS Scholars,"Carnegie Mellon CS Scholars is a program designed to introduce students to the field of computer science. The activity focuses on developing problem-solving skills and understanding of fundamental computer science concepts. Through interactive online modules and guided projects, students will learn about programming, data structures, algorithms, and other key topics in the field. The program aims to provide a solid foundation for students interested in pursuing a career in computer science or related fields.",Computer Science,1,2,1,https://www.cmu.edu/pre-college/academic-programs/computer-science-scholars.html,A computer science program for high school students that offers online courses and coding challenges.
Congressional App Challenge,The Congressional App Challenge is a nationwide competition for students to design and create their own software application. Participants will have the opportunity to showcase their computer science skills by developing an original app and presenting it to a panel of judges. This challenge provides a platform for students to demonstrate their creativity and problem-solving abilities in the field of technology. It is an opportunity to apply coding and programming knowledge to real-world projects and potentially gain recognition for their work.,Computer Science,2,2,1,https://www.congressionalappchallenge.us/,Students create and develop a software application for a specific purpose or audience.
CyberPatriot,CyberPatriot is a cybersecurity competition that simulates real-life scenarios and challenges students to secure computer systems and networks. Participants work in teams to identify and fix vulnerabilities in a set of virtual machines. The competition focuses on the importance of cybersecurity and prepares students for careers in the field. It is a major activity for students interested in computer science and technology.,Computer Science,3,2,1,https://www.uscyberpatriot.org/,A competition where students learn to secure computer systems against cyber attacks.
CyberStart America,"CyberStart America is a program that allows individuals to learn and practice computer science skills in a fun and interactive way. Participants are able to explore various aspects of cybersecurity, coding, and problem-solving through a series of challenges and puzzles. This program is designed for those interested in pursuing a career in computer science or related fields. It provides a hands-on opportunity to develop valuable skills and knowledge in the field of technology.",Computer Science,2,2,1,https://www.cyberstartamerica.org/,An online program that teaches students about cybersecurity through interactive challenges and puzzles.
Girls who Code,"Girls Who Code is a program that focuses on teaching computer science and coding skills to young women. The program aims to close the gender gap in technology by providing opportunities for girls to explore the field of computer science. Through hands-on projects and mentorship from industry professionals, participants learn programming languages, build websites, and develop mobile apps. Girls Who Code also emphasizes the importance of teamwork and leadership in the tech industry. This program provides a supportive and inclusive environment for girls to develop valuable skills for future academic and career opportunities in computer science.",Computer Science,2,2,1,https://girlswhocode.com/,A program designed to teach coding skills to young women.
Google Code-In,"Google Code-In is a global online contest for students interested in computer science. Participants work on tasks provided by open source organizations, gaining hands-on experience in coding, documentation, research, design, and testing. The tasks are varied and cover a wide range of skills, including programming, user interface design, and more. The goal is to introduce students to the world of open source development and provide them with real-world experience working on projects with experienced mentors.",Computer Science,3,2,1,https://codein.withgoogle.com/archive/,A program where students complete coding tasks for open-source projects.
Imagine Cup,"The Imagine Cup is a global competition hosted by Microsoft that focuses on computer science and technology. Participants form teams and use their skills to create innovative projects that address real-world issues. The competition encourages students to think creatively and apply their knowledge of coding, programming, and technology to develop solutions that have a positive impact on society. Winners of the Imagine Cup have the opportunity to showcase their projects on a global stage and receive recognition for their work. This activity provides students with a platform to apply their computer science skills to make a difference in the world.",Computer Science,2,2,1,https://imaginecup.microsoft.com/zh-cn,A competition where students use technology to solve real-world problems.
National Cyber League,"The National Cyber League is a cybersecurity competition where participants can test and enhance their skills in areas such as password cracking, open source intelligence, network traffic analysis, and log analysis. The competition is designed to simulate real-world cybersecurity scenarios, and it provides an opportunity for participants to gain practical experience in a rapidly growing field. Students can compete individually or as part of a team, and the competition allows them to showcase their abilities to potential employers. This activity is ideal for students interested in pursuing a career in cybersecurity or computer science.",Computer Science,2,2,1,https://nationalcyberleague.org/,A national competition testing cybersecurity skills.
National Cyber Scholarship Foundation,"The National Cyber Scholarship Foundation is an opportunity for students to demonstrate their skills in cybersecurity through a series of challenges and competitions. Participants will have the chance to showcase their knowledge of coding, cryptography, and network security. This activity provides an opportunity for students to learn new skills and gain experience in a rapidly growing field.",Computer Science,1,2,1,https://www.nationalcyberscholarship.org/,An activity that provides scholarships and training in cybersecurity.
USACO,"USACO is a competitive programming competition that challenges participants to solve a series of algorithmic problems using computer programming. The competition is designed to test students' problem-solving skills and knowledge of data structures and algorithms. Participants are given a set of problems to solve within a specific time frame, and their solutions are evaluated based on correctness, efficiency, and speed. USACO provides a platform for students to improve their programming abilities and compete with peers from around the world.",Computer Science,3,2,2,http://www.usaco.org/,A competitive programming competition that challenges students to solve complex algorithmic problems.
Wharton Data Science Academy,"The Wharton Data Science Academy is an educational program focused on the field of data science. It provides participants with the opportunity to learn about data analysis, statistics, and programming through a series of online courses and interactive learning modules. The program covers topics such as data visualization, machine learning, and data-driven decision making, giving students a comprehensive understanding of this rapidly growing field. Participants will have the chance to apply their newly acquired skills to real-world data sets, gaining practical experience in data analysis and interpretation.",Computer Science,2,2,1,https://globalyouth.wharton.upenn.edu/programs-courses/data-science-academy/,A program that teaches students data science skills using real-world applications and projects.
Economics for Leaders Program,"The Economics for Leaders (EFL) Program is a specialized program designed for students interested in learning about economics in a real-world context. The program focuses on teaching students about the principles of economics, including supply and demand, market structures, and economic policy. Students will engage in interactive activities, discussions, and simulations to gain a deeper understanding of how economic systems function. The EFL Program provides a unique opportunity for students to develop critical thinking and problem-solving skills while exploring the impact of economics on a global scale.",Economics,2,1,1,https://fte.org/students/economics-for-leaders-program/,A program designed to teach students about economic principles and leadership skills.
Fed Challenge,"The High School Fed Challenge is an Economics competition where students analyze economic and financial conditions and make a presentation to a panel of judges role-playing as the Federal Reserve. Students must demonstrate a deep understanding of monetary policy, economic indicators, and current events to make informed decisions. The goal is to simulate real-world economic scenarios and provide students with a hands-on experience in economic analysis and public speaking. This activity helps students develop critical thinking skills and gain practical knowledge about the economy and financial systems.",Economics,2,2,1,https://www.newyorkfed.org/outreach-and-education/high-school/high-school-fed-challenge,Students analyze economic data and make recommendations for monetary policy to a panel of judges.
